{
  "kind": "RecipeResult",
  "apiVersion": "aicr.run/v1",
  "metadata": {
    "version": "1.0.0",
    "appliedOverlays": [
      "base",
      "monitoring-hpa",
      "h100-any",
      "eks",
      "eks-ubuntu",
      "eks-training",
      "h100-eks-training",
      "h100-eks-ubuntu-training",
      "h100-eks-ubuntu-training-kubeflow"
    ]
  },
  "criteria": {
    "service": "eks",
    "accelerator": "h100",
    "intent": "training",
    "os": "ubuntu",
    "platform": "kubeflow"
  },
  "constraints": [
    {
      "name": "K8s.server.version",
      "value": "\u003e= 1.32.4"
    },
    {
      "name": "OS.release.ID",
      "value": "ubuntu"
    },
    {
      "name": "OS.release.VERSION_ID",
      "value": "24.04"
    },
    {
      "name": "OS.sysctl./proc/sys/kernel/osrelease",
      "value": "\u003e= 6.8"
    }
  ],
  "componentRefs": [
    {
      "name": "aws-ebs-csi-driver",
      "namespace": "kube-system",
      "chart": "aws-ebs-csi-driver",
      "type": "Helm",
      "source": "https://kubernetes-sigs.github.io/aws-ebs-csi-driver",
      "version": "2.59.0",
      "valuesFile": "components/aws-ebs-csi-driver/values.yaml",
      "healthCheckAsserts": "# Copyright (c) 2026, NVIDIA CORPORATION \u0026 AFFILIATES.  All rights reserved.\n#\n# Licensed under the Apache License, Version 2.0 (the \"License\");\n# you may not use this file except in compliance with the License.\n# You may obtain a copy of the License at\n#\n#     http://www.apache.org/licenses/LICENSE-2.0\n#\n# Unless required by applicable law or agreed to in writing, software\n# distributed under the License is distributed on an \"AS IS\" BASIS,\n# WITHOUT WARRANTIES OR CONDITIONS OF ANY KIND, either express or implied.\n# See the License for the specific language governing permissions and\n# limitations under the License.\n\n# AWS EBS CSI Driver Health Check\n#\n# Validates that the AWS EBS CSI Driver is running and healthy in the\n# kube-system namespace. Checks that the ebs-csi-controller deployment has\n# at least one available replica and that no EBS CSI driver pods (selected\n# by label) are stuck in Pending, Failed, or Unknown phases. Label selectors\n# are used because kube-system is a shared namespace.\napiVersion: chainsaw.kyverno.io/v1alpha1\nkind: Test\nmetadata:\n  name: aws-ebs-csi-driver-health-check\nspec:\n  timeouts:\n    assert: 5m\n  steps:\n    - name: validate-deployment-exists\n      try:\n        # Guard against vacuous pass: verify the ebs-csi-controller\n        # deployment exists and has at least one ready replica.\n        - assert:\n            resource:\n              apiVersion: apps/v1\n              kind: Deployment\n              metadata:\n                name: ebs-csi-controller\n                namespace: kube-system\n              status:\n                (availableReplicas \u003e `0`): true\n    - name: validate-all-pods-healthy\n      try:\n        # Assert no EBS CSI driver pods are in unhealthy phases\n        # (Pending / Failed / Unknown) or stuck in Running phase\n        # with a known-bad container-waiting reason\n        # (CrashLoopBackOff, ImagePullBackOff, ErrImagePull,\n        # CreateContainerConfigError). Phase-only filtering misses\n        # CrashLoopBackOff because such pods typically remain in\n        # Running phase with an unhealthy container.\n        # Uses label selector because kube-system is a shared namespace.\n        - error:\n            resource:\n              apiVersion: v1\n              kind: Pod\n              metadata:\n                namespace: kube-system\n                labels:\n                  app.kubernetes.io/name: aws-ebs-csi-driver\n              status:\n                phase: Pending\n        - error:\n            resource:\n              apiVersion: v1\n              kind: Pod\n              metadata:\n                namespace: kube-system\n                labels:\n                  app.kubernetes.io/name: aws-ebs-csi-driver\n              status:\n                phase: Failed\n        - error:\n            resource:\n              apiVersion: v1\n              kind: Pod\n              metadata:\n                namespace: kube-system\n                labels:\n                  app.kubernetes.io/name: aws-ebs-csi-driver\n              status:\n                phase: Unknown\n        # JMESPath projection (not single-element match): kyverno-json's\n        # sliceNode.Assert gates on exact slice length before per-element\n        # comparison, so a `containerStatuses: - state: ...` shape only\n        # matches single-container pods and silently passes sidecars. Use\n        # `containerStatuses[?...] | length(@) \u003e 0` to fire on any\n        # container at any index. Parallel initContainerStatuses block\n        # below catches init-container failures (invisible to\n        # containerStatuses). Per PR #1245 review (@ArangoGutierrez).\n        - error:\n            resource:\n              apiVersion: v1\n              kind: Pod\n              metadata:\n                namespace: kube-system\n                labels:\n                  app.kubernetes.io/name: aws-ebs-csi-driver\n              status:\n                ((containerStatuses || `[]`)[?state.waiting.reason == 'CrashLoopBackOff' || state.waiting.reason == 'ImagePullBackOff' || state.waiting.reason == 'ErrImagePull' || state.waiting.reason == 'CreateContainerConfigError'] | length(@) \u003e `0`): true\n        - error:\n            resource:\n              apiVersion: v1\n              kind: Pod\n              metadata:\n                namespace: kube-system\n                labels:\n                  app.kubernetes.io/name: aws-ebs-csi-driver\n              status:\n                ((initContainerStatuses || `[]`)[?state.waiting.reason == 'CrashLoopBackOff' || state.waiting.reason == 'ImagePullBackOff' || state.waiting.reason == 'ErrImagePull' || state.waiting.reason == 'CreateContainerConfigError'] | length(@) \u003e `0`): true\n"
    },
    {
      "name": "aws-efa",
      "namespace": "kube-system",
      "chart": "aws-efa-k8s-device-plugin",
      "type": "Helm",
      "source": "https://aws.github.io/eks-charts",
      "version": "v0.5.29",
      "valuesFile": "components/aws-efa/values.yaml",